{
    "$schema": "http://json-schema.org/draft-07/schema#",
    "$id": "https://eks.engineering/schemas/eks_setup_schema.json",
    "version": "1.11.0",
    "title": "EKS Setup Schema - Declarations",
    "description": "Global property declarations. v1.2.1: discipline_registry changed to $ref-only. v1.2.2: project_rules_registry changed to $ref-only (inline values moved to eks_project_rules_config.json) per audit — SSOT enforced. v1.3.0: added project_setup property (T1.67). v1.4.0: reshaped project_setup to DCC-aligned object model (folders/root_files/schema_files/environment/dependencies/discovery_rules/validation_rules/project_metadata) per T1.85. v1.5.0: flattened project_setup — setup values (folders/root_files/schema_files/environment/dependencies/project_metadata) are now TOP-LEVEL properties (no project_setup wrapper), aligning EKS eks_config.json with DCC project_config.json (T1.90). v1.6.0: added system_parameters property for T1.97/I088. v1.7.0: added workflow_files and tool_files top-level properties for T1.98.6/I090 (DCC project_config parity). v1.8.0: added project_definition property for I265 T1.190 — per-project definition registry superseding project_rules_registry. v1.9.0: removed project_rules_registry property + required entry for I265 T1.196 — eks_project_rules_config.json retired. v1.10.0 (I281 T1.223): added processing_profiles property — object keyed {type}_profiles (extraction/chunking/embedding/asset/ontology/retrieval/prompt/validation/indexing/ai_reasoning/graph_mapping), each a name→per-type-def map; validates eks_processing_config.json (SSOT §9 — values live there, never in base/setup). v1.11.0 (I287 T1.239): processing_profiles gains filename_profiles + file_property_profiles + os_properties sections — the Phase-1 file-processing chain consolidated from doc config (T1.238).",
    "allOf": [
        { "$ref": "eks_base_schema.json" }
    ],
    "type": "object",
    "properties": {
        "$schema": { "type": "string" },
        "$id": { "type": "string" },
        "version": { "type": "string" },
        "title": { "type": "string" },
        "description": { "type": "string" },
        "project_definition": {
            "$ref": "https://eks.engineering/schemas/eks_base_schema.json#/definitions/project_definition_registry_def",
            "description": "Per-project definitions (I265 T1.190). Keys are project codes. Profile references resolved by ProjectDefinitionResolver at runtime. Replaces project_rules_registry as the project-specific SSOT."
        },
        "processing_profiles": {
            "type": "object",
            "description": "Reusable processing profile registries (I281 T1.223). Object keyed by profile-type section — each {type}_profiles key maps profile names to their per-type def. Actual VALUES live in eks_processing_config.json (SSOT §9/§16); base/setup hold shape only. v1.11.0 (I287 T1.239): added filename_profiles (name→filename_profile_def), file_property_profiles (name→file_property_profile_def, bound_extraction_profile inherits extraction_method per I277 gate), and os_properties (TOP-LEVEL shared key, Q1) — the Phase-1 file-processing chain sections.",
            "properties": {
                "filename_profiles": {
                    "type": "object",
                    "description": "Reusable filename parsing profiles keyed by profile name (I287 T1.238 — consolidated from doc config filename_profiles). Profile names referenced by Project Definition document_profile.filename_pattern.",
                    "propertyNames": { "pattern": "^[a-z_]+$" },
                    "additionalProperties": { "$ref": "https://eks.engineering/schemas/eks_base_schema.json#/definitions/filename_profile_def" }
                },
                "file_property_profiles": {
                    "type": "object",
                    "description": "Per-file-type property extraction profiles keyed by profile name (I287 T1.238 — consolidated from doc config file_property_patterns.by_file_type). Each binds supported_extensions to an extraction profile via bound_extraction_profile (I277 gate). Naming convention {extraction_profile}_props cross-checked by SchemaLoader.",
                    "propertyNames": { "pattern": "^[a-z_]+$" },
                    "additionalProperties": { "$ref": "https://eks.engineering/schemas/eks_base_schema.json#/definitions/file_property_profile_def" }
                },
                "os_properties": {
                    "$ref": "https://eks.engineering/schemas/eks_base_schema.json#/definitions/os_properties_def",
                    "description": "OS-level property collection (I287 T1.238 Q1 — TOP-LEVEL shared key, NOT nested per profile)."
                },
                "extraction_profiles": {
                    "type": "object",
                    "description": "Extraction (parsing) profiles keyed by profile name.",
                    "propertyNames": { "pattern": "^[a-z_]+$" },
                    "additionalProperties": { "$ref": "https://eks.engineering/schemas/eks_base_schema.json#/definitions/extraction_profile_def" }
                },
                "chunking_profiles": {
                    "type": "object",
                    "propertyNames": { "pattern": "^[a-z_]+$" },
                    "additionalProperties": { "$ref": "https://eks.engineering/schemas/eks_base_schema.json#/definitions/chunking_profile_def" }
                },
                "embedding_profiles": {
                    "type": "object",
                    "propertyNames": { "pattern": "^[a-z_]+$" },
                    "additionalProperties": { "$ref": "https://eks.engineering/schemas/eks_base_schema.json#/definitions/embedding_profile_def" }
                },
                "asset_profiles": {
                    "type": "object",
                    "propertyNames": { "pattern": "^[a-z_]+$" },
                    "additionalProperties": { "$ref": "https://eks.engineering/schemas/eks_base_schema.json#/definitions/asset_profile_def" }
                },
                "ontology_profiles": {
                    "type": "object",
                    "propertyNames": { "pattern": "^[a-z_]+$" },
                    "additionalProperties": { "$ref": "https://eks.engineering/schemas/eks_base_schema.json#/definitions/ontology_profile_def" }
                },
                "retrieval_profiles": {
                    "type": "object",
                    "propertyNames": { "pattern": "^[a-z_]+$" },
                    "additionalProperties": { "$ref": "https://eks.engineering/schemas/eks_base_schema.json#/definitions/retrieval_profile_def" }
                },
                "prompt_profiles": {
                    "type": "object",
                    "propertyNames": { "pattern": "^[a-z_]+$" },
                    "additionalProperties": { "$ref": "https://eks.engineering/schemas/eks_base_schema.json#/definitions/prompt_profile_def" }
                },
                "validation_profiles": {
                    "type": "object",
                    "propertyNames": { "pattern": "^[a-z_]+$" },
                    "additionalProperties": { "$ref": "https://eks.engineering/schemas/eks_base_schema.json#/definitions/validation_profile_def" }
                },
                "indexing_profiles": {
                    "type": "object",
                    "propertyNames": { "pattern": "^[a-z_]+$" },
                    "additionalProperties": { "$ref": "https://eks.engineering/schemas/eks_base_schema.json#/definitions/indexing_profile_def" }
                },
                "ai_reasoning_profiles": {
                    "type": "object",
                    "propertyNames": { "pattern": "^[a-z_]+$" },
                    "additionalProperties": { "$ref": "https://eks.engineering/schemas/eks_base_schema.json#/definitions/ai_reasoning_profile_def" }
                },
                "graph_mapping_profiles": {
                    "type": "object",
                    "propertyNames": { "pattern": "^[a-z_]+$" },
                    "additionalProperties": { "$ref": "https://eks.engineering/schemas/eks_base_schema.json#/definitions/graph_mapping_profile_def" }
                }
            },
            "additionalProperties": false
        },
        "discipline_registry": {
            "type": "object",
            "description": "Reference to discipline fragment schema (SSOT — must update eks_discipline_schema.json for new disciplines)",
            "properties": {
                "$ref": { "type": "string" }
            },
            "required": ["$ref"]
        },
        "project_registry": {
            "type": "object",
            "description": "Reference to project code fragment schema",
            "properties": {
                "$ref": { "type": "string" }
            },
            "required": ["$ref"]
        },
        "department_registry": {
            "type": "object",
            "description": "Reference to department fragment schema",
            "properties": {
                "$ref": { "type": "string" }
            },
            "required": ["$ref"]
        },
        "facility_registry": {
            "type": "object",
            "description": "Reference to facility fragment schema",
            "properties": {
                "$ref": { "type": "string" }
            },
            "required": ["$ref"]
        },
        "global_paths": { "$ref": "https://eks.engineering/schemas/eks_base_schema.json#/definitions/global_paths_def" },
        "registry": { "$ref": "https://eks.engineering/schemas/eks_base_schema.json#/definitions/registry_def" },
        "parsers": { "$ref": "https://eks.engineering/schemas/eks_base_schema.json#/definitions/parsers_def" },
        "embedding": { "$ref": "https://eks.engineering/schemas/eks_base_schema.json#/definitions/embedding_def" },
        "vector_store": { "$ref": "https://eks.engineering/schemas/eks_base_schema.json#/definitions/vector_store_def" },
        "logging": { "$ref": "https://eks.engineering/schemas/eks_base_schema.json#/definitions/logging_def" },
        "system_parameters": { "$ref": "https://eks.engineering/schemas/eks_base_schema.json#/definitions/system_parameters_def" },
        "folders": {
            "type": "array",
            "description": "Required and optional project folders (top-level — DCC project_config pattern, T1.90)",
            "items": { "$ref": "https://eks.engineering/schemas/eks_base_schema.json#/definitions/folder_entry_def" }
        },
        "root_files": {
            "type": "array",
            "description": "Files required at project root level (top-level, T1.90)",
            "items": { "$ref": "https://eks.engineering/schemas/eks_base_schema.json#/definitions/root_file_entry_def" }
        },
        "schema_files": {
            "type": "array",
            "description": "Required JSON schema definition files (top-level, T1.90)",
            "items": { "$ref": "https://eks.engineering/schemas/eks_base_schema.json#/definitions/schema_file_entry_def" }
        },
        "workflow_files": {
            "type": "array",
            "description": "Pipeline/workflow files required by the project (top-level, DCC project_config pattern, T1.98.6/I090)",
            "items": { "$ref": "https://eks.engineering/schemas/eks_base_schema.json#/definitions/workflow_file_entry_def" }
        },
        "tool_files": {
            "type": "array",
            "description": "Tool/utility files required by the project (top-level, DCC project_config pattern, T1.98.6/I090)",
            "items": { "$ref": "https://eks.engineering/schemas/eks_base_schema.json#/definitions/tool_file_entry_def" }
        },
        "discovery_rules": {
            "type": "array",
            "description": "Pattern-based rules for auto-discovering files (top-level, T1.90)",
            "items": { "$ref": "https://eks.engineering/schemas/eks_base_schema.json#/definitions/discovery_rule_def" }
        },
        "environment": {
            "type": "array",
            "description": "Environment specifications for the project (top-level, T1.90)",
            "items": { "$ref": "https://eks.engineering/schemas/eks_base_schema.json#/definitions/environment_entry_def" }
        },
        "dependencies": {
            "$ref": "https://eks.engineering/schemas/eks_base_schema.json#/definitions/dependency_config_def",
            "description": "Required/optional Python dependencies (top-level, T1.90)"
        },
        "validation_rules": {
            "type": "array",
            "description": "Validation rules for project setup (top-level, T1.90)",
            "items": { "$ref": "https://eks.engineering/schemas/eks_base_schema.json#/definitions/validation_rule_entry_def" }
        },
        "project_metadata": {
            "$ref": "https://eks.engineering/schemas/eks_base_schema.json#/definitions/project_metadata_def",
            "description": "Project metadata (top-level, T1.90)"
        }
    },
    "required": ["project_definition", "discipline_registry", "project_registry", "department_registry", "facility_registry", "global_paths", "registry", "embedding", "vector_store", "logging", "folders", "root_files", "schema_files", "environment", "dependencies", "project_metadata"],
    "additionalProperties": false
}
