{
    "$schema": "https://eks.engineering/schemas/eks_setup_schema.json",
    "$id": "https://eks.engineering/configs/eks_config_default.json",
    "version": "1.11.0",
    "title": "EKS Default Project Configuration — v1.11.0 (parsers section removed — parser_class single-sourced in eks_processing_config.json#/extraction_profiles, I287 T1.241)",
    "project_definition": {
        "$ref": "https://eks.engineering/configs/eks_project_definition_config.json"
    },
    "discipline_registry": {
        "$ref": "https://eks.engineering/schemas/eks_discipline_schema.json"
    },
    "project_registry": {
        "$ref": "https://eks.engineering/schemas/eks_project_code_schema.json"
    },
    "department_registry": {
        "$ref": "https://eks.engineering/schemas/eks_department_schema.json"
    },
    "facility_registry": {
        "$ref": "https://eks.engineering/schemas/eks_facility_schema.json"
    },
    "global_paths": {
        "data_dir": "data",
        "output_dir": "output",
        "archive_dir": "archive",
        "config_dir": "config",
        "log_dir": "log",
        "eks_root": "eks"
    },
    "registry": {
        "type": "duckdb",
        "connection_string": "output/eks_registry.db"
    },
    "embedding": {
        "active_provider": "openai",
        "model_name": "text-embedding-3-small",
        "dimensions": 1536
    },
    "vector_store": {
        "url": "http://localhost:6333",
        "collection_name": "eks_chunks",
        "distance_metric": "Cosine"
    },
    "logging": {
        "default_level": 1,
        "debug_file_path": "output/debug_log.json"
    },
    "system_parameters": {
        "fail_fast": true,
        "log_level": 1,
        "debug_mode": false,
        "skip_readiness": false,
        "retry_count": 3,
        "retry_delay": 0.5,
        "api_timeout": 120,
        "ollama_timeout": 30,
        "db_timeout": 30,
        "export_default": "both",
        "telemetry_verbose": true
    },
    "folders": [
        { "name": "eks/archive", "required": true, "purpose": "Archived/superseded files", "auto_created": true },
        { "name": "eks/config", "required": true, "purpose": "Schema and configuration files", "auto_created": true },
        { "name": "eks/data", "required": true, "purpose": "Input documents for ingestion", "auto_created": false },
        { "name": "eks/output", "required": true, "purpose": "Pipeline outputs (debug logs, reports, graphs)", "auto_created": true },
        { "name": "eks/engine", "required": true, "purpose": "Core processing modules", "auto_created": true },
        { "name": "eks/log", "required": true, "purpose": "Issue, update, and test logs", "auto_created": true },
        { "name": "eks/docs", "required": true, "purpose": "Documentation", "auto_created": false },
        { "name": "eks/workplan", "required": true, "purpose": "Workplans and reports", "auto_created": true },
        { "name": "eks/test", "required": true, "purpose": "Unit and integration tests", "auto_created": true },
        { "name": "eks/ui", "required": true, "purpose": "User interface (Phase 5)", "auto_created": false },
        { "name": "eks/engine/core", "required": true, "purpose": "Foundation: registry, revision, config", "auto_created": true },
        { "name": "eks/engine/parsers", "required": true, "purpose": "Plug-in document parsers", "auto_created": true },
        { "name": "eks/engine/chunking", "required": true, "purpose": "Chunking strategies and registry (Phase 2)", "auto_created": false },
        { "name": "eks/engine/embedding", "required": true, "purpose": "Embedding providers (Phase 2)", "auto_created": false },
        { "name": "eks/engine/vector_store", "required": true, "purpose": "Vector DB interface (Phase 2)", "auto_created": false },
        { "name": "eks/engine/graph", "required": true, "purpose": "Knowledge graph (Phase 3)", "auto_created": false },
        { "name": "eks/engine/extractors", "required": true, "purpose": "Engineering object metadata extractors (Phase 3)", "auto_created": false },
        { "name": "eks/engine/retrieval", "required": true, "purpose": "Retrieval and scoring pipeline (Phase 4)", "auto_created": false },
        { "name": "eks/engine/cache", "required": true, "purpose": "Retrieval cache (Phase 5)", "auto_created": false },
        { "name": "eks/engine/logging", "required": true, "purpose": "Tiered logging infrastructure", "auto_created": true }
    ],
    "root_files": [
        { "name": "eks/eks.yml", "required": true, "purpose": "Conda environment specification", "extension": "yml" }
    ],
    "workflow_files": [
        { "filename": "eks/ui/backend/phase1_server.py", "required": true, "description": "Phase 1 backend server (dashboard API)", "type": "python_module" }
    ],
    "tool_files": [
        { "filename": "eks/engine/core/setup_validator.py", "required": true, "description": "Project setup validation utilities", "type": "python_script" }
    ],
    "schema_files": [
        { "filename": "eks/config/schemas/eks_base_schema.json", "required": true, "description": "Core base schema — definitions" },
        { "filename": "eks/config/schemas/eks_setup_schema.json", "required": true, "description": "Core setup schema — declarations" }
    ],
    "discovery_rules": [
        { "pattern": "*_base_schema.json", "directory": "eks/config/schemas", "recursive": false, "auto_register": true, "category": "base_schema" },
        { "pattern": "*_base.json", "directory": "eks/config/schemas", "recursive": false, "auto_register": true, "category": "base_schema" },
        { "pattern": "*_setup_schema.json", "directory": "eks/config/schemas", "recursive": false, "auto_register": true, "category": "setup_schema" },
        { "pattern": "*_config.json", "directory": "eks/config/schemas", "recursive": false, "auto_register": true, "category": "config_data" },
        { "pattern": "*.json", "directory": "eks/engine/parsers", "recursive": false, "auto_register": true, "category": "parser_config", "exclude_patterns": ["__*"] }
    ],
    "environment": [
        {
            "name": "conda",
            "required": true,
            "file": "eks/eks.yml",
            "location": "root",
            "python_version": "3.13",
            "conda_env": "eks",
            "key_dependencies": [
                "duckdb", "jsonschema", "pymupdf", "python-docx",
                "openpyxl", "psutil", "rdflib", "fastapi", "uvicorn",
                "qdrant-client", "neo4j", "openai", "tiktoken",
                "pytest", "referencing"
            ]
        }
    ],
    "dependencies": {
        "required": [
            "duckdb", "jsonschema", "pymupdf", "python-docx",
            "openpyxl", "psutil", "rdflib", "fastapi", "uvicorn",
            "qdrant-client", "neo4j", "openai", "tiktoken",
            "pytest", "referencing"
        ],
        "optional": [],
        "engines": []
    },
    "project_metadata": {
        "project_id": "EKS-001",
        "project_name": "Engineering Knowledge System",
        "version": "1.0.0",
        "created_date": "2026-06-11",
        "last_modified": "2026-07-11"
    }
}
